{
  "schema": "atlas-diagram-request.v1",
  "request_id": "atlas-example-debug-001",
  "goal": "Isolate why the local diagram proxy is unavailable.",
  "title": "Proxy availability diagnosis",
  "route": { "mode": "debug" },
  "diagram": {
    "type": "diagnostic-flow",
    "layout": "top-to-bottom",
    "include": ["health check", "origin check", "configuration", "proxy logs", "result"],
    "relationships": [{ "from": "health check", "to": "origin check", "label": "if healthy" }, { "from": "health check", "to": "configuration", "label": "if unavailable" }],
    "boundaries": [{ "name": "read-only diagnostics", "contains": ["health check", "origin check", "proxy logs"] }]
  },
  "intent": { "operation": "generate", "validation": "proxy" },
  "provenance": { "producer": "atlas-one", "created_at": "2026-07-16T00:00:00Z" }
}
