{
  "schema": "atlas-diagram-request.v1",
  "request_id": "atlas-example-analyze-001",
  "goal": "Map the causes of repeated deployment failures.",
  "title": "Deployment failure cause map",
  "route": { "mode": "analyze" },
  "diagram": {
    "type": "cause-map",
    "layout": "left-to-right",
    "include": ["symptoms", "candidate causes", "evidence", "unknowns"],
    "relationships": [{ "from": "candidate causes", "to": "symptoms", "label": "may cause" }],
    "boundaries": [{ "name": "evidence state", "contains": ["evidence", "unknowns"] }]
  },
  "intent": { "operation": "generate", "validation": "schema-only" },
  "provenance": { "producer": "atlas-one", "created_at": "2026-07-16T00:00:00Z" }
}
